{
  "$schema": "http://json-schema.org/draft-04/schema#",
  "type": "object",
  "properties": {
    "id": {
      "type": "string"
    },
    "title": {
      "type": "string"
    },
    "publisher": {
      "type": "string"
    },
    "descriptionMarkdown": {
      "type": "string"
    },
    "graphQueries": {
      "type": "array",
      "items": [
        {
          "type": "object",
          "properties": {
            "metricName": {
              "type": "string"
            },
            "legend": {
              "type": "string"
            },
            "baseQuery": {
              "type": "string"
            }
          },
          "required": [
            "metricName",
            "legend",
            "baseQuery"
          ]
        }
      ]
    },
    "sampleQueries": {
      "type": "array",
      "items": [
        {
          "type": "object",
          "properties": {
            "description": {
              "type": "string"
            },
            "query": {
              "type": "string"
            }
          },
          "required": [
            "description",
            "query"
          ]
        },
        {
          "type": "object",
          "properties": {
            "description": {
              "type": "string"
            },
            "query": {
              "type": "string"
            }
          },
          "required": [
            "description",
            "query"
          ]
        },
        {
          "type": "object",
          "properties": {
            "description": {
              "type": "string"
            },
            "query": {
              "type": "string"
            }
          },
          "required": [
            "description",
            "query"
          ]
        },
        {
          "type": "object",
          "properties": {
            "description": {
              "type": "string"
            },
            "query": {
              "type": "string"
            }
          },
          "required": [
            "description",
            "query"
          ]
        },
        {
          "type": "object",
          "properties": {
            "description": {
              "type": "string"
            },
            "query": {
              "type": "string"
            }
          },
          "required": [
            "description",
            "query"
          ]
        },
        {
          "type": "object",
          "properties": {
            "description": {
              "type": "string"
            },
            "query": {
              "type": "string"
            }
          },
          "required": [
            "description",
            "query"
          ]
        },
        {
          "type": "object",
          "properties": {
            "description": {
              "type": "string"
            },
            "query": {
              "type": "string"
            }
          },
          "required": [
            "description",
            "query"
          ]
        },
        {
          "type": "object",
          "properties": {
            "description": {
              "type": "string"
            },
            "query": {
              "type": "string"
            }
          },
          "required": [
            "description",
            "query"
          ]
        }
      ]
    },
    "connectivityCriterias": {
      "type": "array",
      "items": [
        {
          "type": "object",
          "properties": {
            "type": {
              "type": "string"
            },
            "value": {
              "type": "array",
              "items": [
                {
                  "type": "string"
                }
              ]
            }
          },
          "required": [
            "type",
            "value"
          ]
        }
      ]
    },
    "dataTypes": {
      "type": "array",
      "items": [
        {
          "type": "object",
          "properties": {
            "name": {
              "type": "string"
            },
            "lastDataReceivedQuery": {
              "type": "string"
            }
          },
          "required": [
            "name",
            "lastDataReceivedQuery"
          ]
        }
      ]
    },
    "availability": {
      "type": "object",
      "properties": {
        "status": {
          "type": "integer"
        },
        "isPreview": {
          "type": "boolean"
        }
      },
      "required": [
        "status",
        "isPreview"
      ]
    },
    "permissions": {
      "type": "object",
      "properties": {
        "resourceProvider": {
          "type": "array",
          "items": [
            {
              "type": "object",
              "properties": {
                "provider": {
                  "type": "string"
                },
                "permissionsDisplayText": {
                  "type": "string"
                },
                "providerDisplayName": {
                  "type": "string"
                },
                "scope": {
                  "type": "string"
                },
                "requiredPermissions": {
                  "type": "object",
                  "properties": {
                    "read": {
                      "type": "boolean"
                    },
                    "write": {
                      "type": "boolean"
                    },
                    "delete": {
                      "type": "boolean"
                    }
                  },
                  "required": [
                    "read",
                    "write",
                    "delete"
                  ]
                }
              },
              "required": [
                "provider",
                "permissionsDisplayText",
                "providerDisplayName",
                "scope",
                "requiredPermissions"
              ]
            },
            {
              "type": "object",
              "properties": {
                "provider": {
                  "type": "string"
                },
                "permissionsDisplayText": {
                  "type": "string"
                },
                "providerDisplayName": {
                  "type": "string"
                },
                "scope": {
                  "type": "string"
                },
                "requiredPermissions": {
                  "type": "object",
                  "properties": {
                    "action": {
                      "type": "boolean"
                    }
                  },
                  "required": [
                    "action"
                  ]
                }
              },
              "required": [
                "provider",
                "permissionsDisplayText",
                "providerDisplayName",
                "scope",
                "requiredPermissions"
              ]
            }
          ]
        }
      },
      "required": [
        "resourceProvider"
      ]
    },
    "instructionSteps": {
      "type": "array",
      "items": [
        {
          "type": "object",
          "properties": {
            "title": {
              "type": "string"
            },
            "description": {
              "type": "string"
            },
            "instructions": {
              "type": "array",
              "items": [
                {
                  "type": "object",
                  "properties": {
                    "parameters": {
                      "type": "object",
                      "properties": {
                        "linkType": {
                          "type": "string"
                        }
                      },
                      "required": [
                        "linkType"
                      ]
                    },
                    "type": {
                      "type": "string"
                    }
                  },
                  "required": [
                    "parameters",
                    "type"
                  ]
                }
              ]
            }
          },
          "required": [
            "title",
            "description",
            "instructions"
          ]
        },
        {
          "type": "object",
          "properties": {
            "title": {
              "type": "string"
            },
            "description": {
              "type": "string"
            }
          },
          "required": [
            "title",
            "description"
          ]
        }
      ]
    },
    "metadata": {
      "type": "object",
      "properties": {
        "id": {
          "type": "string"
        },
        "version": {
          "type": "string"
        },
        "kind": {
          "type": "string"
        },
        "source": {
          "type": "object",
          "properties": {
            "kind": {
              "type": "string"
            }
          },
          "required": [
            "kind"
          ]
        },
        "author": {
          "type": "object",
          "properties": {
            "name": {
              "type": "string"
            }
          },
          "required": [
            "name"
          ]
        },
        "support": {
          "type": "object",
          "properties": {
            "name": {
              "type": "string"
            },
            "link": {
              "type": "string"
            },
            "tier": {
              "type": "string"
            }
          },
          "required": [
            "name",
            "link",
            "tier"
          ]
        }
      },
      "required": [
        "id",
        "version",
        "kind",
        "source",
        "author",
        "support"
      ]
    }
  },
  "required": [
    "id",
    "title",
    "publisher",
    "descriptionMarkdown",
    "graphQueries",
    "sampleQueries",
    "connectivityCriterias",
    "dataTypes",
    "availability",
    "permissions",
    "instructionSteps",
    "metadata"
  ]
}